{
  "page_number": 2,
  "image_width": 2615,
  "image_height": 2550,
  "source_pdf": "45929 10-Jul-2026 14-51-57.pdf",
  "annotator": "UNASSIGNED",
  "timestamp": "2026-09-23T00:00:44.707876+00:00",
  "rooms": [],
  "dimensions": [],
  "structural_elements": [],
  "table_rows": [],
  "text_labels": []
}
