{
  "page_number": 1,
  "image_width": 1991,
  "image_height": 3300,
  "source_pdf": "46148(1) 13-Sep-2026 11-44-21.pdf",
  "annotator": "UNASSIGNED",
  "timestamp": "2026-09-23T00:01:04.446940+00:00",
  "rooms": [],
  "dimensions": [],
  "structural_elements": [],
  "table_rows": [],
  "text_labels": []
}
