{
  "page_number": 1,
  "image_width": 2195,
  "image_height": 3300,
  "source_pdf": "45808 03-Jun-2026 14-39-51.pdf",
  "annotator": "UNASSIGNED",
  "timestamp": "2026-09-23T00:00:19.709835+00:00",
  "rooms": [],
  "dimensions": [],
  "structural_elements": [],
  "table_rows": [],
  "text_labels": []
}
