{
  "page_number": 1,
  "image_width": 2096,
  "image_height": 3300,
  "source_pdf": "46050 21-Aug-2026 17-32-39 (1).pdf",
  "annotator": "UNASSIGNED",
  "timestamp": "2026-09-23T00:00:49.839101+00:00",
  "rooms": [],
  "dimensions": [],
  "structural_elements": [],
  "table_rows": [],
  "text_labels": []
}
